text,span1,label
"In 1979 a train carrying chlorine , liquid petroleum , toluene and propane was derailed in Mississauga , Ontario , causing a series of explosions .","[14, 15]",0
China claims that the Hong Kong Government recently gave a written commitment to limit the activities of the pro-democracy movement in the territory .,"[8, 9]",1
"Peter Crowther , managing director of a Leeds business centre , recently bought two semi-detached stone cottages in Bramhope , on the outskirts of Leeds , at an auction in the village pub .","[3, 4]",0
The standard method of producing task descriptions is to write all the separate sub-tasks at various levels on cards and then assemble the cards in a network .,"[9, 10]",0
"‘ With an auction , you 've got to be certain that at least two buyers are there who can commit themselves , and the difficulty is that buyers who can proceed are few and far between , ’ said David Phillip , a director of Yorkshire estate agents Dacre Son and Hartley .","[7, 8]",0
"Increased demand for its road , rail and sea container fleets during the first half helped boost the latest figures .","[16, 17]",1
The solid uncooperative bundle was surprisingly heavy ; it was like trying to manoeuvre a firm and rather smelly poultice .,"[11, 12]",1
"He had himself been rising thirty-seven and when The Yellow Chair was put on had passed that age , was older now than Van Gogh , as he had , in the 1940s , realised that he was older than Keats .","[12, 13]",1
"This means in practice that district medical officers are charged with preparing an annual report , presenting and interpreting epidemiological data , identifying local health problems and evaluating service outcomes .","[11, 12]",0
"So far they have received nothing from the Government , little EC assistance and are running out of funds donated by individuals and industry .","[19, 20]",1
Alice Mair said : ‘ I 'm giving a dinner party on Thursday evening .,"[7, 8]",1
"IF a dwelling house is in such a state of disrepair as to be prejudicial to health or a nuisance , the tenant may lay an information against his landlord alleging the existence of a statutory nuisance under the Public Health Act 1936 .","[24, 25]",1
I think we are likely to succeed — thanks in part to the very generous example set by Lord Rothschild .,"[16, 17]",1
"But it 's true , it does make a noise .","[7, 8]",1
"Beyond the barrier lay some of the most toxic chemicals known , awaiting destruction by fire .","[10, 11]",0
"The biogeochemical system embraces the totality of the movements of the key elements essential to life — carbon , nitrogen , oxygen , phosphorus and others — through what has been described as the total earth system .","[31, 32]",0
‘ Do you realize what will happen to you if you are tried ? ’,"[3, 4]",0
But a door had opened somewhere .,"[4, 5]",0
So we are left with eqn ( 3.11 ) .,"[3, 4]",1
"Not so long ago it seemed as if the world was to divide into three main trading blocks : the EC based around the West German economy ; a Northern American block based around the US-Canadian free trade area , and a Pacific unit incorporating the Asian tigers with Japan and the yen at the centre .","[21, 22]",1
But Ruth had no heart either to appreciate or to envy her mistress .,"[7, 8]",0
But how will I know where to go ? .,"[7, 8]",0
I do n't see how they 're going to do it .,"[3, 4]",1
"Dolphins swimming near the barrier altered their behaviour to avoid it , the result , the scientists believe , of them detecting sonar echoes from the reflectors .","[21, 22]",1
Arising from the evidence in the literature and from our empirical studies at Chelsea College it is now possible to offer a model which is compatible with all the evidence and which also has considerable predictive potential .,"[0, 1]",1
He is wearing a blue tunic and around his shoulders is a fur cloak made of the skins of the hyrax .,"[14, 15]",0
Parliament urged to think again on housing issue : .,"[1, 2]",1
Under Malcolm Fraser the party began to make effective use of its support in Fleet Street .,"[5, 6]",1
"The character of the rocks , and their setting in the past geography at the time when they accumulated , diagnoses the climatic setting in which the extinct fauna lived , and climate imposes certain restraints on possible modes of life .","[33, 34]",1
"Without our knowledge , over the years , with the use of their money and supportive people in the Swiss banks , they forged contacts with those left behind in East Germany .","[27, 28]",0
"The armoured or plated dinosaurs include some species that seem too heavily burdened with protective armour to have been very active , but this does not necessarily mean that they had to be cold-blooded .","[3, 4]",1
"One of the purposes of an extended period of single-sex science teaching might be to let teachers see how girls approach scientific matters , and to discover , what may well be the case , that girls are just as capable of ‘ scientific thinking ’ as boys .","[15, 16]",0
A new canvass system was introduced in 1911 so that all county constituencies would operate the same system and so that duplicate records could be kept at area level .,"[14, 15]",1
"Such writing rapidly palls , and I hope that in the novels to come , Motion can curb his reckless passion for it .","[17, 18]",0
"Do n't forget Ann , in fact it 's probably one of and in the back .","[2, 3]",0
"He wrote a fulsome 400-page autobiography , characteristically entitled Virgil Thomson on Virgil Thomson , and a personal survey , American Music since 1910 , appeared in 1972 , followed recently by a selected edition of his letters .","[29, 30]",1
But see if I get out in .,"[4, 5]",0
"she 's started Liam , they 're having a pre-packed school at Durham choir boys , whatever it is , cos he 's from school , apparently the locality of demanding six year olds and under so they and another labouring school","[2, 3]",0
You can help us . ’,"[2, 3]",0
The room in which they were sitting underwent the curious shrinking process to which it was subject whenever he was reminded of Wyvis Hall or his Uncle Hilbert or even if the county of Suffolk were mentioned .,"[6, 7]",0
"Most of them are probably muttering , ‘ I 'm too busy to get involved in this sort of thing .","[5, 6]",0
"Although the proposed method is novel , it is but one of an increasingly large number of methods designed to detect and model ‘ clusters ’ of disease ( see , for example , Cuzick and Edwards 1990 ) .","[22, 23]",0
Oh I see .,"[2, 3]",1
"Alright , you might have got the odd but it 's all this warming , doing it and then half leaving it and then","[5, 6]",0
Has the election campaign penetrated its grim streets ?,"[4, 5]",1
The few models which have been developed to date may have been correct as far as they go but are clearly incomplete .,"[6, 7]",0
"Hardly a page goes by without the hapless Francis noticing something which reminds him , improbably , of something else .","[12, 13]",0
"Fifty miles north , Sarah Morgan had just finished serving a lunch that no one had done more than pick at .","[9, 10]",0
"So it 'll be the working people , er , probably the the national er , health stamp 'll have to go , go up .","[21, 22]",0
"Sections 3.6–3.16 are concerned with magnetostatics , where electric fields are assumed to be zero and the interrelationship of J , H , and B are studied .","[11, 12]",1
"Metaphor lay coiled in the name sunflower , which not only turned towards but resembled the sun , the source of light .","[2, 3]",1
"He joined William Jenkins , appointed chief organizing agent in 1911 and previously district agent for the Midlands Liberal Unionists .","[1, 2]",1
"‘ Now come into the garden , ’ she added , smiling .","[9, 10]",1
Deep down he knew .,"[3, 4]",0
It 's just that I 'm saving .,"[6, 7]",1
It is convenient to retain the nuclear/non-nuclear distinction when discussing the background to emergency planning .,"[9, 10]",0
"when she was only a second year therefore that means , she 's not given enough work , but I mean","[9, 10]",1
"A user may have a deep knowledge of business problems , but knowing little about computers , has no idea how they should be tackled .","[24, 25]",1
Joseph Chamberlain retained his preference for independence but allowed himself to be overruled by Austen and by the overwhelming wishes of the Liberal Unionist Council to merge .,"[8, 9]",0
His concern was solely with effectiveness rather than style ; he rarely spoke with more than brief notes and left it to the occasion to furnish the words .,"[25, 26]",1
"They were , however , an all-White group , operating without directly involving parents and were generally committed to specialist care in the community .","[12, 13]",0
"I 'm trying to reduce the number of business administrators : the fewer there are , the simpler the system and the cheaper it will be . ’","[2, 3]",0
Children have served philosophy very well .,"[2, 3]",1
"‘ It may seem a little odd for prison staff to be looking at their prisoners as customers , but they are the direct consumers of our service , ’ explained Mr Stephen Twinn , prison director , who spent 23 years in the public sector at various grades of prison governor .","[39, 40]",1
"Paths and boundaries vanished , allowing the tides of street life to wash right up to the doorsteps .","[3, 4]",1
On his head he wears a head-dress of lion mane .,"[4, 5]",0
only just sort of see them occasionally to get the inside stories to .,"[8, 9]",1
And Di will be really pissed off,"[5, 6]",0
And then Kimmy can come and visit and play in the garden !,"[4, 5]",0
Today 's attraction-merchants are doing no more to lure 20th-century tourists than their medieval forebears did for pilgrims .,"[8, 9]",0
"A more general definition of resistance valid for varying cross-sections may be easily arrived at , but it is hardly worth the trouble .","[13, 14]",1
You do n't think they work properly ?,"[5, 6]",1
"A political commentator of our own day , Paul Johnson , quoted it not long after Major became Prime Minister to suggest that it was also true of him .","[21, 22]",1
"Harsh measures — putting an entire community under an absolute curfew for a continuous lengthy period of time , demolishing homes , uprooting olive or citrus trees , physical intimidation and terror tactics employed by raiding army units , shooting , killing , cutting off water or electricity supplies and telephone links to villages or towns , mass arrests , intimidatory interrogation techniques — can either create a temporary lull or activate an eruption .","[71, 72]",1
Task analysis has not and can not be reduced to a set of standardised procedures which the aspiring analyst could acquire in a formal training course .,"[20, 21]",1
Law : Always take along a friend to sue : Litigation can pay off even in the unlikeliest circumstances .,"[8, 9]",0
"As this is not a book on criminological theories , what follows will be a brief overview of a wide range of theories and explanations .","[11, 12]",1
"It is therefore , Sartre argues , our historical task to make it known , promoting not just the historical process as such , but also the general recognition whereby the plurality of the meanings of individual histories can be seen to combine to make one history , with one meaning — the ‘ Truth of humanity ’ ( I , 822 ) .","[5, 6]",0
"There she was in a conventional two-piece suit , fine dark wool , muted geometrical pattern in greens and unexpected straw browns , caught in at the waist — still very thin — to give the effect of a bustle , the skirt long and straight to the knee .","[23, 24]",1
The voice at the other end was plainly over-excited and it took him a minute to disentangle what he was being told .,"[21, 22]",0
"Afterwards they lay quietly side by side , not speaking , until he said , ‘ I must go . ’","[18, 19]",0
In fact anti-racism and anti-sexism seem to come naturally to the Ahlbergs .,"[7, 8]",1
The first was opened in the village of Vemdalen in the remote forests of Sweden in September 1985 .,"[3, 4]",1
"The ‘ silence over race ’ was breached in 1980–1 , but in 1985 debate about racial issues was taken a step further .","[7, 8]",1
I handled some and so did Mueller .,"[1, 2]",1
"The picture , very like the one Rufus Fletcher had taken in the summer of 1976 , occupied the screen for about fifteen seconds .","[17, 18]",1
Getting the economy right .,"[0, 1]",1
Travel : Copse and robbers Christopher Somerville sees how woodland has usurped the ancient cattle thieves of the Cheviot Hills,"[11, 12]",1
Yeah yeah and I mean yeah We 'll definitely be finished in about an hour,"[10, 11]",0
"Davis , of course , would have walked into England 's team in Poland a week on Wednesday ; until last season 's prolonged suspension , followed by injury , Bobby Robson had him firmly pencilled in as Bryan Robson 's replacement .","[26, 27]",1
All our efforts to restore unity among Christians will be in vain if they are not carried out in total fidelity to the faith in Christ … handed on by the Apostles . ’,"[4, 5]",1
The consequences for some nations or subgroups in a population of being without access to environmental data or the tools for analysing them while others have such access are potentially profound — as the European Commission has recognized in issuing a directive on public access to environmental data ( CEC 1990d ) — yet space limitations have also precluded their discussion .,"[21, 22]",0
"Psychological theories , however , see these characteristics as a result of unusual or abnormal experiences , rather than as inherited .","[20, 21]",1
He sounded somewhat to the right of Genghis Khan .,"[1, 2]",0
Frederica listened attentively ; went on and signed the Visitors ' Book .,"[1, 2]",0
"It was raining intermittently all the time they were in the cemetery , the pines bowing and shivering in the wind .","[17, 18]",1
The backs were mainly pedestrian but the fundamental problem lay elsewhere .,"[9, 10]",1
Where are you talking about ?,"[3, 4]",0
"You can only see twelve feet er , you 'd think the place was empty in the bar .","[3, 4]",0
"For example , in 1692 , the whole of southern England was affected by an earthquake whose epicentre was located in what is now Belgium ; a good deal of minor structural damage was inflicted ( Morse 1983 ) .","[12, 13]",0
"‘ Its main concerns would become food and the people who consume it , not farming and those who produce it . ’","[15, 16]",0
"The GIST hypothesis was that female under-achievement in science and technology is at least partly socially constructed by the school , an hypothesis based on research evidence as well as critical feminist analysis ( see , for example , Kelly , 1981 ) .","[23, 24]",1
"She had met him back home in the west country when he had come to supervise a show put on by one of the big ready-to-wear labels , Carnega , for whom he worked as a junior member of the design team .","[18, 19]",1
It was not unlike the feeling she experienced when men looked at her and wanted her though she knew it could not be that for there was nothing sexual between her and Gary and never would be .,"[14, 15]",0
"He stiffened as he recognized a man move upstairs with a distinctive , boneless saunter : he had better send someone up to check the backgammon room .","[23, 24]",0
And do n't try and get the door open . ’,"[5, 6]",0
"What do you mean , what 's happening tomorrow ?","[7, 8]",0
"Fulham Greyhound 175 Fulham Palace Rd , W6 ( 385 0526 ) Home of heavy rock , so take your ear-plugs .","[18, 19]",0
"Last week he promised to supply us with a written explanation of the way his company had treated Debbie , but it never arrived .","[3, 4]",0
"He finds out what the needs of the business are , and prescribes the cure .","[1, 2]",0
No it 's the flour and things like that we said it 's,"[10, 11]",0
The book — which opens a projected sequence of novels that will cover the period from 1968 to the present day — aims to explore what the blurb describes as ‘ the painful transition from youth to adulthood ’ .,"[12, 13]",1
But she could walk it from her house could n't she ?,"[3, 4]",0
"Most advocates of biological theories do not express themselves in the same bizarre language and style as Lombroso , and such theories of crime are not merely historical relics that died with Lombroso .","[30, 31]",1
He does n't wan na know !,"[5, 6]",0
‘ Thinking of Peter . ’,"[1, 2]",0
This example assumes that a sympathy for motorists with overwhelm any tendency to logical analysis .,"[2, 3]",1
"We do n't want to buy it , we just want the catalogue","[3, 4]",0
Its continued presence always surprised him since it served no purpose that he could see except symbolically to cut off the headland and to give travellers pause to consider whether they really wanted to continue .,"[4, 5]",1
THE QUESTION of just who would even want to be a partner with the US was underlined last night as the American Administration headed for default for the first time in its history .,"[23, 24]",1
or if you want the full glory .,"[3, 4]",0
"You know what happens , d' ya know what happens then they 'll get people","[13, 14]",0
The answer sometimes given is that murderers should be treated differently because they are particularly dangerous : anyone who chooses to kill once can choose to kill again .,"[19, 20]",0
"Moreover , few would dispute that this apparent decline is a reality : the first words of the Prime Minister herself , after the result of the 1987 election was known , were an acknowledgement of the challenge posed to Government by the ‘ inner cities ’ .","[4, 5]",0
"The very narrow emergency planning zones contrast with those in the USA ( Collins 1981 ) , where planning is required up to 16 km from the site to cover exposure to radiation plumes .","[29, 30]",0
"You 'd got the toilet there and behind the door , I mean you had to sort of squeeze yourself and shut the door , and behind the door was a shower .","[2, 3]",0
"He pulled on his respirator , his mind made up to get back to her as soon as he could , for Nell Anderson was all he cared about now .","[8, 9]",1
I knocked out by four .,"[1, 2]",1
"Well Loaded Much talked-about guitar rockers , generally regarded as destined for the bigger stadia of life , unless they self-destruct en route .","[20, 21]",1
"Ruth could think of few worse fates , but her stomach lurched at the thought of leaving Millfield .","[2, 3]",0
"Many of the new arrivals , who waited in the street outside the embassy , said they were convinced there would be another train for them .","[18, 19]",0
And she got ta showed down,"[4, 5]",0
"Find a 1980 Toyota Corolla or 1982 Nissan Sunny that has not succumbed to rust , and you can buy with confidence .","[12, 13]",1
"First , it would consolidate the structures of the developing national authority which is competing to replace the occupation authority .","[16, 17]",1
"so he 's killing himself laughing I I 've got to tell you Ron , I 've been taping he said I do n't give a monkeys you tape what , he said let them all hear , they 'll all be able to pass it round !","[44, 45]",1
"She had let her overwhelming desire feed her imagination ; had read something into his words , his looks , his actions , which had not been there at all .","[6, 7]",1
"If a society lets any considerable number of its members grow up mere children , incapable of being acted on by rational consideration of distant motives , society has itself to blame for the consequences .","[10, 11]",0
"And Vera phoned this morning , Joe phoned this morning all I did n't want them to go out , anyway I 've made arrangements to go round to see Vera on Friday afternoon and they they went out to where was it ?","[23, 24]",1
"In all this , there are perhaps a couple of things which look plausible when we compare the philosopher 's child with our mental picture ; Aristotle 's observation that children are immature and Mill 's suggestion that they might need protection .","[12, 13]",1
"She had known him since he was a very small five-year-old , perched like a mosquito on one of the placid beginners ' ponies , so she told the class to carry on walking their ponies while she came to him .","[38, 39]",0
what 's happen with the .,"[2, 3]",0
"No , you do n't want a wee wee cos I have to go .","[13, 14]",0
"Whatever else such a strategy may achieve , it certainly does not manage to produce a situation in which children are politically indistinguishable from adults and it rests on premises which , unless they can be defended , gain nothing for any defence to the charge of arbitrariness .","[6, 7]",1
The majority of natural hazard research has focused on single hazards but of course any area may be prone to more than one hazard type .,"[7, 8]",0
She sat down and prepared to wait as long as was necessary .,"[4, 5]",0
"Experience with practical calculations helps , but even after years of work one usually remains this side of infallibility .","[14, 15]",1
Yeah you can talk and,"[3, 4]",0
The book — which opens a projected sequence of novels that will cover the period from 1968 to the present day — aims to explore what the blurb describes as ‘ the painful transition from youth to adulthood ’ .,"[28, 29]",1
And since they 've refused repeatedly to have a public inquiry into what is going on there we 're not certain of the safety of what 's coming out .,"[4, 5]",0
Tell him that I am very sorry but I can not make exceptions .,"[11, 12]",1
"Start at one end of the ship , making as much noise as possible . ’","[8, 9]",1
"They begged Rytasha for reimbursement , but none was forthcoming , and for the want of a few hundred pounds the village lost its crop for the year .","[22, 23]",1
"He knew that he was oversensitive to the timbre of the human voice and hers , although not jarring or unpleasant , sounded a little forced as if she were deliberately speaking at an unnatural pitch .","[22, 23]",0
"Until 1990 , remarkably little interaction had taken place between the ‘ hard science ’ and the social science communities on global monitoring and prediction .","[7, 8]",0
"Making sure to appear casual , he carefully watched the men in dinner jackets and the women in full-length décolleté dresses move slowly over the red carpet towards the restaurant at the rear , or climb the staircase to the gaming rooms .","[8, 9]",0
"Substituting the above equation into eqn ( 3.1 ) we get formula , or using the vector relation ( eqn ( A.6 ) ) we obtain the modified form formula .","[0, 1]",1
"The paradigm which is described originates from doctoral research into generic probation practice and has been presented in a book Adult Probation and Juvenile Supervision : Beyond the Care-Control Dilemma ( 1989 , Gower ) .","[4, 5]",0
"Warm-blooded animals have the same body temperatures at all times , and can be more continuously active , but they use far more energy — and hence need more food — than cold-blooded animals of the same size .","[27, 28]",0
"Well , one can use eqn ( 3.1 ) as it is , but very often one is better off by using its integral form that can be obtained by integrating both sides of eqn ( 3.1 ) over a surface formula .","[28, 29]",1
"It is a rambling Tudor house run by John and Margaret Parker , whose breakfast room and drawing room look out over a wonderful walled garden , beyond which fields of grazing cows stretch down to the river .","[17, 18]",0
I 'm not allowed to Wednesdays cos your mum do n't watch it on a Wednesday !,"[6, 7]",0
"Most athletes first encountered him as a voice , bellowing in multi-lingual fury at officials who had broken rules or arrangements designed to make racing safer or more fair .","[17, 18]",1
"Wall Street has been hitting new peaks this week too , which has given support to the London market ( and even Japan 's Nikkei index , in a typically erratic period , has gained nearly 800 points while London added its 245 ) but London has real strengths of its own .","[34, 35]",1
Was his whole life affected by what had happened at Ecalpemos ?,"[8, 9]",0
People people were running away from you .,"[3, 4]",1
"So I said , if you are a good girl you can choose a cake .","[12, 13]",0
"For instance , Diggle et al. ( 1990 ) assess the hypothesis that cancer of the larynx is associated with proximity to a now-closed incinerator and develop a statistical model from the theory of spatial point processes to test this .","[9, 10]",0
You need to sort of stop and talk when you have food .,"[3, 4]",0
"There ai n't no pill to get you off the powder , Mr Breakspear , only will power .","[6, 7]",1
"He asserts it often enough : ‘ History continually effects totalisations of totalisations , ( I , 15 ) .","[1, 2]",0
"We have so far talked about positive and negative charges , about point charges , and distributed charge .","[16, 17]",0
We could still be looking for it when they blow us out of the water . ’,"[9, 10]",1
"The context is , of course , the context of ergonomics as conceived by the designers of the list .","[12, 13]",1
"To be sure there was still a strong response opposing Enoch Powell 's call for repatriation , from all shades of political opinion , but the racialization of public debate about the 1985 riots went much further than 1980–1 .","[9, 10]",0
"She walked behind the bar , got herself a drink and went and fucking sat and watched us !","[16, 17]",0
Thus the curl operates on the coordinates of P but not on those of dl leading to formula where ir is the unit vector in the direction r and we have made use of the vector relation ( A3 ) in the Appendix .,"[2, 3]",1
"Electors are always prepared to criticise the Government in answer to pollsters ' questions , but when the same individuals arrive at the polling booth they simply can not bring themselves to vote Labour into power .","[3, 4]",1
And she said that she 'd had the baby she was great .,"[2, 3]",0
