text,span1,label
"As Davies ( 1981 ) has pointed out , speech is the basic tool of the social worker .","[6, 7]",1
I see,"[1, 2]",1
"This has been recognized by , among others , ESSC ( 1988 ) .","[3, 4]",0
"Indeed , many systems of criminal law impose a mandatory sentence for murder ( or whatever the highest form of homicide is called in that system ) .","[7, 8]",1
"IT WAS unfair of Auden to suggest , in his ‘ Letter to Lord Byron ’ , that a poet 's ‘ sense of other people 's very hazy ’ .","[6, 7]",1
Do you want a whole ?,"[2, 3]",0
"I give them a , I did give them a good rinse afterwards though .","[1, 2]",1
"the rain came down and the floods came up and the house on the rocks slid down , but the foolish man built his house upon the sand , the foolish man built his house upon the sand , the foolish man built his house upon the sand and the rain came tumbling down","[15, 16]",0
"Their cases humped upstairs and put into the bedroom , Adam looked Rufus Fletcher up in the phone book .","[5, 6]",0
Hillslope failure ( as at Aberfan in South Wales in 1966 ) is a geomorphic hazard but may arise because of raw material extraction .,"[18, 19]",0
"He sucked on his cigarette , furiously threw it into the fireplace , shoved his hands in his pockets , and glared at Adam .","[1, 2]",0
"No one appeared as he drew up and , before lifting his hand to the bell , he paused to read the words of a stone plaque embedded in the flints to the right of the door .","[20, 21]",0
"And now although her whole body cried out for fulfilment and she longed for Joss Barnet to complete what he had surely come to do , she knew that she must not let it happen .","[12, 13]",0
"‘ We are an aggressive company , ’ admitted David Wheeler , operations director at this plant and at Rechem 's other incinerator , at Fawley .","[8, 9]",1
In parliament there would be a carefully organized campaign of resistance that would at least slow the government down and raise Unionist morale .,"[7, 8]",0
"They say there were blank sheets bearing Dali 's signature alongside 20,000 fake Miros and 650 fake Chagalls .","[6, 7]",1
Would you agree with that or I find that hard to believe .,"[7, 8]",1
Note the enormous flexibility compared with a routine which would tell him only how to get from one particular point to another .,"[0, 1]",1
"A vast , smoke-blackened furnace ; 100 people to do the work ; massive investment — the company spent £2m last year on cleaning up smoke emissions .","[18, 19]",1
"All in all , it was not surprising that Suger , mulling over the precedents of early crusading , tried to dissuade Louis VII from embarking on his Jerusalem journey in 1145 .","[25, 26]",1
John come to me and he said is that your number ?,"[6, 7]",0
Avon treads warily .,"[1, 2]",1
Well why in the bloody hell I did n't go then ?,"[9, 10]",0
"He sat down and saw a bifurcated path , simmering with gold heat round and under the rising , spreading blue-black-green down-pointing vanes of a great pine , still widening where the frame interrupted its soaring .","[19, 20]",1
"'Bye for now ! ’ she called , and ran in through the imposing front door .","[13, 14]",0
I do n't want to spend a fortnight on the road .,"[3, 4]",0
"So Lewis did not say , even to himself , when he was privately considering trying to get hold of his son in Tenerife , that he disliked Adam and would have been pleased to spoil his holiday .","[17, 18]",1
"The treaty between Robert II of Flanders and Henry I of England , renewed by their successors , stipulated that each knight supplied to the English king should bring three horses with him — this at a time when a horse represented a major investment .","[28, 29]",0
"These include the highly specialized nature of much of the technical analysis , the limited capacity for checking the accuracy of many of the findings of this kind of research and the consequent need for the development of knowledge-based inference machines for extracting useful information from secondary and often proxy data .","[1, 2]",1
"You need a secure situation with someone you can trust , who you know will stick around because he loves you .","[15, 16]",0
"If the dinosaur did , after all , live on dry land , then the long neck could have usefully functioned to allow the animal to browse the high foliage of trees ( see p. 116 ) .","[8, 9]",0
Ellen asked before I could refuse to answer .,"[5, 6]",0
One ca n't usually assign some arbitrary value to the divergence of a vector function .,"[4, 5]",1
The great philosophers have always produced such a person-oriented account at least for those whose education was thought to matter .,"[5, 6]",1
Leinster have been undermined by their failure to secure prestige fixtures since the mid-Seventies .,"[3, 4]",1
Up to now we have not enquired into the question of how the current arose .,"[14, 15]",1
"Some of the reasons for this — the difficulty of deciding on appropriate proxy variables and on economical yet non-biasing temporal and spatial sampling frameworks , taking account of the relative importance of aperiodic and rare events as compared to near-continuous processes , processing the vast volumes of data usually involved and organizing the multidisciplinary and ( often ) multinational researchers involved — are discussed briefly later .","[61, 62]",0
"In his book L'Uomo Delinquente , Lombroso developed a complex description of what he called the ‘ born criminal ’ , who could be recognised by a variety of physical characteristics , in particular facial characteristics — for example large jaws and ears , and high cheek bones .","[14, 15]",1
"For example , Field End House had been open for three years as a specialist unit for children with learning difficulties , and was designed to offer respite ‘ round the clock ’ care .","[19, 20]",0
I said do you think Charlotte will eat a turkey steak with garlic and herbs ?,"[1, 2]",0
"Tom , we must go . ’","[4, 5]",0
"Because the networks believe westerns appeal mainly to middle-aged men , Young Riders has a cast of five pouting young male actors , in an attempt to make a western with ‘ good demographics ’ .","[3, 4]",1
The warm-blooded supporters tend to ally themselves with the supporters of a theory about the relationships of the dinosaurs .,"[3, 4]",1
"Since 1986 Rytasha has broken awayfrom her guru and set up on her own with a charity called Food Relief International , which raises money from the fiercely competitive matrons of Palm Beach and distributes it to the starving people of Bangladesh .","[17, 18]",0
The predatory Ritchie chested the ball down and hammered a volley past Lukic .,"[8, 9]",1
"Just as Thomson transferred Stein 's literary abstraction to music , so these portraits unusually employ the painter 's technique of drawing the sitter from life : an ideal combination of Thomson 's habit of immediate response with an actual subject .","[21, 22]",1
And you ca n't develop a prototype system because the users have n't got a clue what they want .,"[13, 14]",1
spread it,"[0, 1]",0
"In general , our policy should be to proceed with building our state block by block , without waiting to be given a gift of it through negotiations .","[8, 9]",1
aporias — because they seem to be at once the results of a communal enterprise while at the same time bearing witness to the fact that this enterprise never existed except as the inhuman reverse side of two opposed actions in which each aims to destroy the other .,"[43, 44]",1
Recently the life habits of the giants have been looked at in a way that disproves most of these traditional notions .,"[15, 16]",1
"As a result of this he was labelled as a diehard and a bigot , when he actually distrusted the diehards and was himself distrusted by the bigots .","[18, 19]",0
PEOPLE tend to look vague when you mention Poitou .,"[7, 8]",0
That is pushing it .,"[2, 3]",1
The DDI 's smile disappeared .,"[4, 5]",1
"Neither an intention to cause serious injury nor recklessness as to death should be sufficient on its own , but together they restrict one another , producing a test which both satisfies the criterion of certainty and marks out some heinous but non-intended killings .","[22, 23]",1
Oh right can we not take her home ?,"[5, 6]",0
"It had been recognized that Liberals had been more adept at handling the press because they were more ready to stoop to newspaper practices , as Sandars had reported in 1909 :","[3, 4]",1
Radiation readings are taken every hour at each station and are transmitted to a central computer which analyses the data .,"[3, 4]",0
Chelsea might have won had the ball not kept turning into a Mexican bean at Kerry Dixon 's feet .,"[8, 9]",1
These influences laid the foundations for the blend of the naive and the sophisticated which is the hallmark of Thomson 's maturity .,"[2, 3]",1
"In the passage , she stumbled and almost fell , then flung back the door to the bedroom .","[5, 6]",0
There is even some evidence from the tracks they have left behind that Diplodocus and its allies moved about in herds .,"[17, 18]",0
The plane lurches into motion .,"[2, 3]",1
"Forgive me for saying so but the lighting in here is appalling , you do n't you get headaches ?","[0, 1]",0
"‘ The Red what ? ’ said the Exec Director , pleased that he had deciphered the first word of the new code-name .","[15, 16]",0
"On one level this work deals with a generalised ‘ woman 's experience ’ , yet the metaphorical power of Dorothy Hale 's dress derives from Kahlo 's use of clothing in her own self-portraits .","[5, 6]",1
"Though there was a lot to do , Clare , busy redecorating the shop and visiting wholesalers to buy stock , still managed to work one evening a week for the Movement .","[15, 16]",0
‘ Are they milk cattle living in a house as I have heard ? ’,"[5, 6]",0
"Between his becoming Prime Minister and his party 's fall in the polls about 10 days ago , Major did nearly everthing that common opinion wanted him to do .","[25, 26]",1
"Yet others have argued that the unrest can be seen as a symptom of the breakdown of law and order in British society ( Gaffney , 1987 ; Hall , 1987 ; Keith , 1987 ) .","[3, 4]",0
"Here 's us , heading for trouble and God knows what else , and in the middle of you talking about Nordhausen , I start thinking of Peter .","[4, 5]",1
But the hatred they aroused meant that they were liable to be brutally slaughtered if captured afterwards .,"[5, 6]",1
"Ahead of him , trudging along on the left of the path , was a little group of children , the eldest girl wheeling a pushchair with two smaller children , one each side of her , clutching the bars .","[4, 5]",0
"From out of nowhere , Ruth remembered Dick Parker : but not , this time , the pleasure of her union with him , only the pain it had brought her on the Christmas Eve following .","[29, 30]",1
"Before he succeeded Balfour then , Law was not associated with any of the features that were to characterize his party leadership ; his contribution was to use the leadership in the service of all of these causes , to make himself the spokesman for the most spirited sections of the party .","[2, 3]",0
"Here stand the early sixteenth-century timbered Guildhall , now a museum to 700 years of the cloth industry .","[1, 2]",1
"Since it is the equation formula that needs to be satisfied , we should choose the potential as a vector ( called , not without logic , the vector potential ) , defined by the equation formula .","[32, 33]",1
If I 'm going to the South of France I want to stay there for awhile,"[10, 11]",0
Punters often try to avoid paying .,"[4, 5]",1
"Marcia has put more detail onto the Erikson model and suggests that in going from the initial ego-diffusion condition to that of having achieved ego-identity , two processes are involved : crisis and commitment .","[2, 3]",1
"They , they would love him I mean one of them it was annoying really cos Terry 's just not pulling his weight .","[20, 21]",1
She tells me she needs to understand it if she 's going to defeat it . ’,"[13, 14]",1
They 're getting slower !,"[2, 3]",0
‘ Wiped out twenty million Russians for Stalin .,"[1, 2]",1
"the rain came down and the floods came up and the house on the rocks slid down , but the foolish man built his house upon the sand , the foolish man built his house upon the sand , the foolish man built his house upon the sand and the rain came tumbling down","[51, 52]",1
Perhaps they 'll get them .,"[3, 4]",0
"‘ We 're trying to smooth the path for purchasers , and streamline the system , ’ says Graham Harrison , pointing out that live telephone bidding will also be available for those unable to attend .","[5, 6]",1
"In a major emergency , for example , there might be a need to supply blood products held at regional blood banks to hospitals .","[17, 18]",1
"I mean , I think , I , I think the Empire legally is well I thought it was nine hundred","[4, 5]",0
"The actual facts ' of who was arrested during the riots , whether black or white , were hardly debated since it was assumed that they were mostly black and mostly unemployed and involved with crime ( Keith , 1987 ) .","[23, 24]",1
"Scattered through the policy review are proposals to : Drastically alter the status and organisation of the Department of Trade and Industry ; Create two departments — a Department of Consumer Affairs , and a Department for Legal Administration ; Create a Department of Environmental Protection within the existing Department of the Environment ; Set up a plethora of new commissions and executive agencies ; Set up a Women 's Ministry .","[65, 66]",1
"The importance of this debate can be explained , partly , by the political capital which the Opposition could make from linking the social and economic malaise of the country at large with violent street disturbances .","[19, 20]",1
And I 've got ta get erm,"[3, 4]",0
"The party officers and Whips were solidly behind Chamberlain , but Law drew off some of his support among tariff reformers and , urged on by Edward Goulding and Max Aitken , he refused to withdraw unless his continued candidature would allow Long to win .","[41, 42]",1
"Increased demand for its road , rail and sea container fleets during the first half helped boost the latest figures .","[0, 1]",0
Well just go and stand on that path there cos there 's another another car then .,"[4, 5]",0
"you see put John , one of us start trussing early but we did n't need one Ann 's got another team in the other room doing it .","[15, 16]",0
"Yeah we 've got one like that , I know .","[9, 10]",0
"Olives , Frederica agreed with Alexander , could not recall the Mount of Olives , the Garden of Gethsemane , in the day of Van Gogh the pastor 's son , the lay preacher .","[3, 4]",0
"Well erm , they , they do n't know whether they can do it or not do they ?","[8, 9]",0
How did you feel as you came to the end of your working week yesterday afternoon ?,"[6, 7]",1
I know they do .,"[1, 2]",0
"come home from work she said I 've been looking round in Boots and that for you , she said er I 've decided , she said I was gon na get you a gift voucher .","[29, 30]",0
"Precautions will not conquer empires , they will not build great cities , they will not transmute dreams into gold or carry men across wide oceans , and precautions will not , emphatically not , win fair ladies , ’ and here he turned to Ellen and lasciviously dropped his gaze to her long bare legs .","[21, 22]",1
She made a kind of progress up the Palladian marble stair .,"[1, 2]",1
Hi ya,"[0, 1]",0
‘ I told my son only trouble could come from being your pakiteng . ’,"[2, 3]",0
Or : ‘ When Cupid shot his dart He shot it at your heart . ’,"[5, 6]",1
I bet there has .,"[1, 2]",1
"If Dedham Hall is fully booked — and it may well be — try the best bed-and-breakfast we have ever found , just a few miles away at the Old Vicarage , Higham , near Colchester .","[5, 6]",0
I cook for Stuart and I do n't eat it .,"[8, 9]",0
"Listen , go away She does n't say go away very much now .","[0, 1]",0
"It comes under the hammer at 2.15pm on the 20th , at the Barnstaple Motel .","[1, 2]",1
"Gon na have to get one of them dolls , she loves them .","[4, 5]",0
"It has Ely Cathedral , its great green windows casting a translucent light across the Lady Chapel .","[9, 10]",1
"To classify all reckless killings as murder might be too broad , but the point remains that some reckless killings may be thought no less heinous than intentional killings .","[15, 16]",1
"Further afield , we need to recognize that some disasters ( most obviously Chernobyl ) will have implications for more than one country so that environmental monitoring should take place with some kind of international co-ordination .","[28, 29]",1
You can use your cloth daddy,"[2, 3]",0
"‘ You need to understand what your clients ’ expectations are beforehand , ’ says Graham Harrison of Bristol and West .","[4, 5]",0
How high up the ladder did they go ? ’,"[7, 8]",1
"no I 'm alright Ann , I mean , feel a bit ah I mean I 'm sorry I do have to buy a feel a bit of , I feel a bit dizzy you know as if I","[22, 23]",0
"Law personally conducted the negotiations with Gardner Sinclair over the sale of the Observer and the Pall Mall Gazette in 1914 ; this negotiation also demonstrates that , as well as producing information and nursing editors , the party had to work hard to keep some of the newspapers in business .","[2, 3]",1
and Phil went round there yesterday afternoon .,"[2, 3]",1
"In Milan , for example , the commission to design the new generation of ‘ Jumbo ’ trams , which went into service in 1979 , was one that leading Italian architects and designers fought over .","[20, 21]",1
We have now a number of equations describing the same thing .,"[7, 8]",1
"Paul Harrison 's Inside the Inner City : Life under the Cutting Edge focused on Hackney , a London borough ranked among the worst off on any scale of urban deprivation ( Harrison , 1983 ) .","[13, 14]",1
Like I had to give her some top priorities yesterday as she was n't going to be about .,"[4, 5]",1
"That when women are given the vote it follows that children should be given it too is no argument at all , but a version of it occurs in modern debates over the justice or injustice of Mill 's famous disclaimer in his essay On Liberty .","[4, 5]",1
"The final dividend is 26.5p , making a total of 37.5p , against 30p .","[6, 7]",0
So a part of the argument switches to the kind of incinerators you allow while industry is forced to clean itself up .,"[6, 7]",1
I do n't give a fuck !,"[3, 4]",1
"They have also aroused Protestant anger against Dr Runcie , at the same time as he has become involved in a row over his attack on the ‘ Pharisees ’ of British society .","[3, 4]",1
"The imagery of the ‘ black bomber , used in Handsworth was extended to the notion that there were groups of alienated and criminalized young blacks who saw the riots as a chance to engage in an ‘ orgy of looting ’ .","[34, 35]",1
‘ What do you make of Rickie ? ’,"[4, 5]",1
Adam could remember very well but he was n't going to say so .,"[9, 10]",1
cos you know they 're a million times ahead .,"[0, 1]",0
"Come along , Jamie , let's get you back . ’","[5, 6]",0
"Though individuals are nailed , the greatest villain of all is the system .","[3, 4]",1
Oh I know .,"[2, 3]",0
"I could have gone with it , giving myself four blissful miles of upland walking followed by as many miserable hours of fruitless searching for return transport to East Kielder Farm .","[15, 16]",1
"Equally , the ‘ signposting ’ role now being adopted by UNEP 's GRID project — which is expected to offer on-line access to a catalogue of environmental data sets and details of the responsible agencies in 1991 — is to be welcomed .","[20, 21]",0
"we , they the cake and er she would n't would n't sit down so Terry kept saying to her right now what you doing ?","[16, 17]",0
"For 1987 the statistics show that there were some 20,000 accidental deaths , of which some 7,000 occurred in the home , 6,000 at work , and 5,000 on the roads .","[17, 18]",0
Approximately three times as many boys as girls take O level physics and approximately four times as many take CSE physics .,"[18, 19]",1
"Plus a backdrop of houses covering the valley walls on either side , a reminder that wherever industrialised societies decide to deal with their most intractable problems , they are unlikely to find a place to do so which is not in somebody 's back yard .","[21, 22]",1
At what age ought the education for youth to begin ?,"[9, 10]",1
"A new Urban Development Grant was devised , to pump-prime with public funds schemes which would then attract private investment .","[6, 7]",0
"The red and green of the Aztec necklace links it compositionally with the indigenous plants to the ‘ south ’ of the painting , the pink colonial-style dress tonally blending with the skyscrapers to the ‘ north ’ .","[8, 9]",1
And black Ashley came in .,"[3, 4]",1
"GIS work in this field ( e.g. Matthews 1989 ) is reviewed later , but we note here the work of the applied geochemistry group at Imperial College ( responsible for a series of atlases on regional geochemistry ) and the existence of a Society for Environmental Geochemistry and Health .","[1, 2]",0
"Well anyway I was talking to er Rosette tonight cos I went to the office for some change and I , then I had this like .","[11, 12]",0
"You know where er that circle is where there 's the shops , well instead of taking I know , instead of taking one road I took another and I got completely lost !","[22, 23]",1
"He paused before replying , then gave the smallest shake of his head .","[1, 2]",0
EACH new indignity in the heap visited on Welsh rugby seems worse than the last .,"[6, 7]",1
You get enough for twenty five K have n't they ?,"[1, 2]",0
"Heseltine 's vision was of ‘ partnerships which recognise that there are some things that only governments can pay for , but also that the ingenuity and flexibility of the private sector is indispensable ’ ( p. 156 ) .","[8, 9]",1
"Yeah , but , Charlotte , she 's looking away , hey .","[8, 9]",0
"As for other occupants , how would they know who else had lived there ?","[8, 9]",0
"I knew immediately what your message meant : ‘ If you do n't pay up , one slash is all it takes . ’ ’","[6, 7]",1
The Health Secretary accused the unions of ‘ posturing and pretending ’ to run a 999 service yesterday .,"[8, 9]",1
He scrubbed at his face with the handkerchief she offered and gulped for air .,"[11, 12]",1
Have you finished ?,"[2, 3]",0
But I saw no other way out : I did n't know if I would ever have a chance again . ’,"[2, 3]",1
"£45,000 was the asking price and I was not surprised that the sale , so to speak , hung fire .","[16, 17]",0
Or his nature and luck had complied for him .,"[6, 7]",1
"She pledged that the Government would safeguard those that did not opt for trust status , but she expected this to be a minority .","[11, 12]",1
"As you come down , you know .","[6, 7]",0
"Are you coming with me , yeah !","[6, 7]",0
Neither boys nor girls at the moratorium stage are likely to be attracted to the science that is usually presented in our schools .,"[12, 13]",1
His district stretches nearly one hundred and fifty miles .,"[2, 3]",1
Dimples played in his cheeks .,"[1, 2]",1
‘ I 'll give it some paint . ’,"[3, 4]",1
Would you please tell me the high season price for one week ? ’,"[3, 4]",0
"thus one can and must say … that each fight is the singularisation of all the circumstances of the social whole in movement and that by this singularisation , it incarnates the enveloping totalization which the historical process is .","[30, 31]",1
"Along with a selection from a list including women , animals , madmen , foreigners , slaves , patients and imbeciles , children have served in that great class of beings , the ‘ not-men ’ , in contrast with which male philosophers have defined and valued themselves .","[44, 45]",1
We 've got five weeks discouraged from taking more than a fortnight at a time .,"[5, 6]",0
"The GIST interventions described above relate to three of these : VISTA women , albeit briefly and temporarily , redressed the numerical balance by offering female role models of practising scientists ; VISTA and the curriculum development which followed involved a limited ‘ repackaging ’ of science to remove its exclusively masculine appeal , and the single-sex classes and classroom observation showed how science comes to be defined as ‘ masculine ’ in the mixed school .","[24, 25]",0
"Steel-Maitland told Balfour that "" Farquhar and I are endeavouring to raise more money .","[11, 12]",1
"He does get the offer , I mean","[7, 8]",0
"‘ Well , I told them that , ’ Francis Morgan said irritably and his wife and daughter caught each other 's eye in silent agreement that he had n't told them that Angela was refusing point-black to be married from home and was insisting on the full London set-out , reception at the House of Commons , replying unanswerably when he had objected on grounds of expense that she could well afford to pay for it herself .","[39, 40]",0
"The only two Hong Kong legislators who consistently dare to speak out , Mr Martin Lee and Mr Szeto Wah , have been threatened with expulsion from the committee now drafting China 's post-1997 Basic Law .","[23, 24]",0
"Mum do n't feel like making mince pies , today .","[3, 4]",1
"But then , he found it difficult to believe anyone .","[4, 5]",1
Several special science or craft clubs were organized in the lunch hour for girls only and in two schools teachers planned single-sex teaching .,"[7, 8]",0
It was n't the answer that the DDI expected and Sorge regretted his words .,"[8, 9]",0
The standard method of producing task descriptions is to write all the separate sub-tasks at various levels on cards and then assemble the cards in a network .,"[4, 5]",1
