text,span1,label
"And he said er , no , he said I did n't think I had he said , but now , he said I realized that how I , was forgetting er I 'd be talking and I 'd forget sort of what I was just talking about that split second .","[39, 40]",0
A good many men came into the room by no means inclined to acquiesce in the proposed arrangement .,"[11, 12]",1
"The words , in that round childish script , had remained with him .","[10, 11]",1
"alright , yeah I am I mean I 'm not alright , I feel very dizzy , like I say I feel I feel a bit kind of heady you know but I will go and have a check up .","[21, 22]",1
"THIS expanded network of popular committees and institutions making up the Unified leadership is infused by tens of thousands of activists who belong to , or identify with , the different factions of the PLO .","[26, 27]",1
"Suffice to say , whether Boogie , Bop or simply Blues , this set of Brothers , whatever they once were before they fell out and dispatched solicitors to sue their siblings , will be wearing dark glasses , pork pie hats , black side-burns and will be playing Stax/Atlantic type material .","[23, 24]",0
"He would not tell her , this funny bewitching little English girl , that he had come to her first because he could not keep away from her .","[16, 17]",0
"But , as it was built , it should not now be demolished .","[12, 13]",0
Back room stage so small the performers have to rest their mike stands on the floor in front .,"[12, 13]",0
"Will a person 's accent , dress or skin colour indicate the potential terrorist or , for that matter , football hooligan or drug pusher ?","[10, 11]",0
"Sylvie , the cook , sat at the big kitchen table by the window , writing a list and shooing pigeons away .","[15, 16]",0
Britain still can not decide when to play the mandarinate game of silence with the Chinese and when to break the rules ( as Beijing does all the time . ),"[19, 20]",1
"Once that soapbox came out , Major campaigned as if he would now do and say what he really thought .","[19, 20]",0
"Fair enough , I think I work","[6, 7]",1
"As a result of some 40 sub-projects involving all the Member States ( and often several groups within each one ) , databases of topography , soils , water resources and quality , biotopes , atmospheric emissions , climate , soil erosion and administrative boundaries have been built up for the whole Community and can be interrelated ; other data sets ( such as land cover , derived from satellite imagery ) have already been compiled for some of the Member States .","[67, 68]",0
"Only two failed to go : a new mother and her child , who was born in a Polish hospital four days ago .","[4, 5]",0
And when I see these people in nursing homes all sat round a wall in chairs oh God !,"[11, 12]",0
"The physical sciences in particular , offer a conventional career choice which is likely to win approval from parents , teachers and peers .","[15, 16]",1
"To the sentence stem ‘ When a child will not join in group activities … ’ , these boys gave responses like ‘ he is selfish ’ , ‘ he must be stupid ’ , ‘ he deserves to be unpopular ’ .","[19, 20]",1
"The sediments themselves reveal much about the environment of deposition , as was shown in Chapter 3 .","[13, 14]",1
"No , you 've got ta give it me back , I 'm gon na .","[6, 7]",0
"Here , I 'm gon na whisper you something .","[4, 5]",0
Matthews ( 1989 ) has used data from the Regional Cancer Registry ( morbidity rather than mortality data ) and data on trace elements to examine this link .,"[5, 6]",0
aporias — because they seem to be at once the results of a communal enterprise while at the same time bearing witness to the fact that this enterprise never existed except as the inhuman reverse side of two opposed actions in which each aims to destroy the other .,"[20, 21]",1
this principle is meant to apply only to human beings in the maturity of their faculties .,"[3, 4]",0
"The treaty between Robert II of Flanders and Henry I of England , renewed by their successors , stipulated that each knight supplied to the English king should bring three horses with him — this at a time when a horse represented a major investment .","[22, 23]",1
Using plume models that predict the movement of contaminants she is able to intersect the results with data on current well locations and to assess which water supply areas are worst contaminated .,"[31, 32]",0
"Yeah , I mean personally .","[3, 4]",0
"You should of said well alright , I 'll take them away then took them right away then ,","[9, 10]",0
"He always felt that effective musical criticism began by being well written , and he never lost his liveliness .","[16, 17]",1
You fully know as an old pressman the difficulty of dealing with a big speech late at night …,"[10, 11]",1
We can take the eyes first .,"[2, 3]",1
Something weird is happening there .,"[3, 4]",0
In describing its vision of effective supervision the White Paper goes on to note :,"[10, 11]",1
"Now go away , please .","[4, 5]",0
"‘ He told me you two were pakiteng , little heifers . ’","[2, 3]",0
We have to give an answer .,"[3, 4]",1
"Harrison describes ( p. 369 ) the way in which the inner urban powder-keg leads to a vicious circle , with many victims , but few individual villains :","[14, 15]",1
They 've improved the chimney recently and it 's very much better than it was but we still get the smells .,"[18, 19]",1
"He thought , I know what my idea of heaven would be , if by heaven we mean a place of bliss in which to pass eternity : a sanctuary where one might chain-smoke without impairment of breathing , destruction of the lungs or damage to the heart , light each fresh cigarette from the glowing butt of its predecessor , and drink ice-free but hundred-proof chilled vodka laced with two drops of angostura and a gill of newly opened Perrier endlessly , with increasing euphoria until a peak of joy and ease was reached but without any sub-sequent nausea or pain or dehydration or oblivion …","[84, 85]",0
It 's alright do n't worry about it .,"[5, 6]",1
"Research on hazards is multidisciplinary and straddles the social , environmental and mathematical sciences .","[6, 7]",0
Could have gone any time with with nothing through his bloody arteries !,"[2, 3]",1
What was certain was that he could no longer use the escape key .,"[9, 10]",0
"The plaque was unadorned , the letters deeply carved in an elegant script reminiscent of Eric Gill , and Dalgliesh remembered his aunt telling him that it had been placed there by previous owners in the late twenties , when the cottage was originally extended .","[8, 9]",0
"If the ‘ greenness ’ of going unleaded still seems a bit of a grey area , it is possible to switch to diesel without a shadow of environmental doubt .","[6, 7]",0
‘ It 's my life which is about to go down the plughole .,"[9, 10]",1
She assumed wrongly that John House 's colleague was an art historian .,"[1, 2]",1
"Within some sophisticated GIS such as ARC/INFO there are some useful algorithms ( such as shortest path calculations ) , but GIS developers have in general failed to realize the natural links between GIS functions and many operations research techniques .","[26, 27]",1
"I mean , the only way you could do that would be if you had a till at one end and people bought whatever they wanted and were given a voucher and you walked down the other end and exchanged","[25, 26]",0
"Keller 's Zurich upbringing made him into a skiier and sculler , and he raced for the Grasshopper club .","[14, 15]",0
"A good suit was a working model 's uniform — Paula now bought two each season and wore them with perfectly matching accessories , hat , bag and shoes .","[12, 13]",0
Most people are likely to judge the reforms on how long they have to wait for treatment — the issue behind the ‘ Jennifer 's ear ’ controversy during the election campaign .,"[14, 15]",0
A proportion of both boys and girls at ego-identity achievement stage will choose science .,"[12, 13]",1
"Please , I 've found something , I must tell you .","[4, 5]",0
"Erm what if anything have you , erm these are enquiries I 'm making on behalf of my daughter .","[13, 14]",1
"Mr Dobbs , who is chairman of Telecottages UK , warns possible users not to get bogged down with the technology : ‘ The equipment is a tool to overcome what needs to be done .","[16, 17]",1
"Here 's us , heading for trouble and God knows what else , and in the middle of you talking about Nordhausen , I start thinking of Peter .","[25, 26]",0
"Three elements refer to the female presence , all of them dealing with an essential lack .","[11, 12]",1
"Mr Cook argued that 10 years of Thatcherism had been forced on most people , who had never voted Conservative , and that many of those who opposed PR in the Labour Party wanted to use the same undemocratic power ‘ to ram socialism down the throats of a majority who did n't vote for it ’ .","[53, 54]",0
"Sweetman drew on his fancy cigarette , then blew a plume of smoke into Wavebreaker 's rigging before smiling lazily at Ellen .","[18, 19]",0
"But anyway he saw this one stall and he had a look and they had three racks of them for ten ninety nine and then we found some others then , they were they were ten ninety nine but they were as thick as these other ones .","[3, 4]",0
"Fairfax has finished eating , but Claudia 's food is untouched .","[2, 3]",0
"Well who 's doing it , tomorrow , what they call it ?","[10, 11]",1
"John 's told me to tell you to go and get it , right I said I said Richard coming , for four hundred pound I you 're not coming for it so that 's it oh you think it was pub machine or","[8, 9]",0
"Yet the Chelsea manager , Bobby Campbell , and Arsenal assistant , Theo Foley , agreed it had been a good match , and the spectators ' complaints were muted .","[29, 30]",1
"Arresting or deporting the tens of thousands of Palestinian professionals who would be employed in perfectly apolitical , harmless and humanitarian jobs can only further isolate the Israeli Government .","[25, 26]",1
If one manages to find the simplest method at the first attempt that can mostly be attributed to good luck .,"[16, 17]",0
"At a time when the Home Secretary is inviting the Probation Service to ‘ move centre stage in the Criminal Justice System ’ ( NACRO , 1990 , p. 17 ) it may seem misguided and unnecessarily pedantic to take issue with the White Paper 's notion of punishment .","[8, 9]",1
The two companies concerned are trying to record the spoken word .,"[3, 4]",1
Where does Gemma live ?,"[3, 4]",0
This is conceived not as a set of hardware but as a comprehensive information system focused on the needs identified by the ESSC ( see above ) and anticipating somewhat those of IGBP .,"[19, 20]",0
"Using equipment donated by Racal , the scientists have analysed recordings of the ‘ clicking ’ dolphins make while hunting .","[9, 10]",0
"Sir : I was interested by your juxtaposition of ‘ Poll predicts 42-seat majority for Labour ’ with ‘ Tories hold on ’ ( 30 September ) , the latter referring , of course , to the Conservative victory in Wandsworth , the significance of which appears to have been almost totally ignored by the media .","[20, 21]",1
they get permission then ?,"[1, 2]",1
They 're not pursuing it until we put these things out .,"[3, 4]",1
"So like , you go one , two , three , four , five , six six times you swap","[19, 20]",1
"These are sensuous pleasures at their most enjoyable when we ritualise them , but how do we feel when we desire them ?","[17, 18]",1
When you walked into the well what I would call a cupboard but they classed it as the bathroom .,"[2, 3]",0
‘ So do these fellas you pick up .,"[6, 7]",1
"Certainly , Mr Wheeler convinced me that his company was going to huge lengths to keep itself clean .","[10, 11]",1
"Mum do n't feel like making mince pies , today .","[5, 6]",0
‘ And Goodenache 's running from the Russians .,"[4, 5]",1
You must be willing to be helped and help others — your experiences will be useful to other group members .,"[8, 9]",0
"Clearly , a plant which stores 1 tonne less than is required for notification slips through the net , while large numbers of handling sites ( warehouses , for instance ) are not covered .","[11, 12]",0
"‘ Many people have suffered from sales falling through and from house-buying chains , and some of our vendors feel that now 's as good a time as any to sell . ’","[4, 5]",0
"Some deflowered rose bushes , on the left a stretch of the park — red-ochre — the soil scorched by the sun , covered with fallen pine needles .","[23, 24]",0
""" Herod then with wrath was filled . ""","[6, 7]",1
A less direct measure which is applicable only to the most senior management is to observe the fall or rise of the share price when a particular executive leaves or joins a company .,"[30, 31]",1
How could this take place ?,"[3, 4]",1
"However , the later withdrawal of government support , with the scrapping of the Community Programme as unemployment receded , left many of these voluntary organizations high and dry .","[11, 12]",1
Trellis is a useful compromise and you can always pretend it was forced on you by the speed of growth of your climbing rose .,"[12, 13]",1
"Oh come on Christopher come and sometimes it in the right panel , that 's the right panel there and then it goes in the left hand and then it goes to the right hand and then it goes to the left then right , the left , the right , left , right , left , confusing , but it 's that hand to start with","[1, 2]",1
He saw a mass of freckles — sometimes melding into sixpenny-sized brown patches of warmth — moving over the hard frame of cheekbones and brow .,"[16, 17]",1
The authors were asked to review the current state of the art in their fields with particular reference to the likely requirements of the future policy issues agenda in terms of the demands that they make on geographic information management .,"[5, 6]",0
Well how come,"[2, 3]",1
"The tiny single room was jammed with the mossy timbers of disused sheep pens , but the little iron fire grate that once warmed the hardy men who worked here was still set in the foot of the hut 's tottering gable end , and the massive stone lintel had not yet fallen from its place above the doorway .","[52, 53]",0
"‘ I know that 's what Mueller 's always wanted , but Nate and the Executive Committee would never fall for that bloody empire-building game !","[19, 20]",1
Has he got that thing going ?,"[2, 3]",1
"To quench is more than to refresh although our lying , lascivious eyes tell us the two are the same .","[9, 10]",1
"In 1983 the Home Secretary imposed restrictions on the release of persons serving life for murders of police- and prison-officers , terrorist killings , murder during robbery , and the sadistic or sexual murder of young children , fixing a minimum of twenty years ' imprisonment for these offenders .","[38, 39]",1
"Female exclusion from science and technology , even if it is apparently by girls ' own choice , also means that as citizens their ability to understand and control their environment is limited .","[28, 29]",1
"Schools and teachers tried curriculum development to build on girls ' science interests , changing patterns of classroom interaction , single sex groups and classes .","[7, 8]",1
"Yet the logic of the definition suggested that it would benefit especially kings , whose competence to declare war could not be impugned : thus Thibaud of Blois failed to persuade the monks of Marmoutier that they owed him service when he fought against Louis VI ; they claimed discretion in the matter ; and in 1184 , the mighty Philip of Alsace hesitated to commit to battle the army he had summoned against Philip Augustus , through fear that its ranks might melt away .","[83, 84]",1
Take fifty three .,"[0, 1]",1
"From the purchasers ' point of view , auctions can also be attractive — if slightly nerve-racking as you wait for bidding to start for the house of your dreams .","[19, 20]",0
"She was frowning , deep lines appearing between her eyebrows , mouth drawn down at the edges so that instead of a classically good-looking slim English Rose in her late twenties , she looked faded , years older than her real age , and shrewish .","[6, 7]",1
The FT-SE failed to hold its gains yesterday but shortly after opening it was only six points away from last September 's previous record closing level .,"[2, 3]",1
"Jamie , through a renewed queasiness , just observed that the police driver was instantly reduced to half his age by Miss Williams 's greeting .","[8, 9]",0
"It was in June 1911 that the first scenes of disorder were mounted in the House of Commons , led by Lord Hugh Cecil .","[19, 20]",1
"And Vera phoned this morning , Joe phoned this morning all I did n't want them to go out , anyway I 've made arrangements to go round to see Vera on Friday afternoon and they they went out to where was it ?","[14, 15]",0
"In Glasgow he had picked up many of the skills that a more highly-born politician might have acquired in the Oxford Union or at the Bar , but skills that were very different in appearance .","[17, 18]",1
"Just keep , just , in fact just keep well let's get it sorted out and then we 'll just get er er cos plenty of storage space and stuff .","[13, 14]",1
"The faces of the twins , softer editions of her own , turned towards her questioningly then broke into shy smiles .","[17, 18]",1
"Cross the road now you stand there stand still , give me your other hand good girl right now is it all clear","[5, 6]",0
"It was alleged that the council , being the owners of the premises , were the persons by whose act , default or sufferance the nuisance arose .","[26, 27]",1
"Such language focused attention on the individuals or groups who were ‘ breaking the law ’ , ‘ committing criminal acts ’ , and threatening the interests of the law-abiding ‘ majority ’ .","[24, 25]",1
"On the following morning , she bought a portable TV , a warm winter coat for herself , and new clothes for Josh .","[6, 7]",0
Delaying subject choice : Britain is unusual in asking pupils to make crucial choices about subject options in the 13–16 age range .,"[0, 1]",0
"However , the later withdrawal of government support , with the scrapping of the Community Programme as unemployment receded , left many of these voluntary organizations high and dry .","[20, 21]",1
"Fate determined that a short while before the businesses failed , they transferred the £10,000 to BCI because of the better returns being offered .","[9, 10]",1
"I ca n't make the machine go any bloody quicker , well I can , but I so what 's the point in that come and have a look at it and then they said come back and do it when you on the skin , you know the skin bring it forward well it do n't go back , it just gets all tangled .","[64, 65]",0
"A group of Masai is clearing stones from a stretch of grassland , in the shadow of the Mountain of God .","[5, 6]",0
"Penelope was looking particularly discontented and disaffected , picking at her food .","[8, 9]",0
Above all he restored the focus of music criticism onto the music itself .,"[3, 4]",1
"Both the Model Penal Code test and the Scots test may be reduced to circularity , however , for when one asks how extreme or how wicked the recklessness should be , the only possible answer is : ‘ wicked or extreme enough to justify the stigma of a murder conviction ’ .","[21, 22]",0
So the singular universal presumes the totalization he ca n't ( yet ) prove .,"[13, 14]",0
"The objectives of CORINE were to be achieved through bringing together existing data holdings in the member states , developing methods for holding , analysing and presenting the data , and encouraging the exchange of data .","[24, 25]",0
"WHEN a Charlton chief sat down to dinner in times gone by and found a spur on the table where his meal should have been , he knew the cupboard was bare once more .","[10, 11]",1
"His plans in ruins , he is now reduced , Micawber-like , to hoping something will turn up before his players face the All Blacks in five short weeks .","[8, 9]",1
Part of the attraction of alternative cancer treatments such as the Gerson therapy is that they allow a patient to feel more in control of the treatment .,"[16, 17]",1
"Miss Williams 's natural pitch , well suited to reaching across a hunting-field , was discreetly reduced .","[9, 10]",1
"‘ I never see how they get the sales per square foot in these places , ’ Barton observed , without further greeting .","[6, 7]",1
The section describing the operation of the system should cover not only how the system operates but also how the user can operate it .,"[22, 23]",0
"They claim to see each other less than couples who go out to work , meeting for the occasional cup of coffee in the kitchen .","[13, 14]",0
"Ideally one could construct a model of the fossil to test out these various functions in experiments , but the number of examples where the analysis has been pursued this far are limited .","[28, 29]",1
"Their problem seems to be not one of the inability to choose goals or to form strategies for achieving them , but an incorrigible propensity to choose the wrong ones and an awesome efficiency in achieving them unless adults intervene .","[2, 3]",0
The Paul Jones and the emotional somersaults when the music stopped and they came face to face for the very first time .,"[10, 11]",1
Well my mum got it for,"[3, 4]",0
"In Four Saints Thomson 's informality was given free reign since he first of all improvised the music at the piano then , when it stuck , wrote it down to a figured bass .","[32, 33]",1
She took ill at Aunty Edith 's .,"[1, 2]",1
"Images of ‘ urban decay ’ , ‘ tinderbox cities ’ , and ‘ ghetto streets ’ linked up with the images of ‘ race inequality ’ and ‘ black ghettos ’ to produce an analysis more complex but also more contradictory .","[33, 34]",1
She recalled a promise made by Mr Major when he became Prime Minister : that he would work for a nation at ease with itself .,"[4, 5]",1
Murder is committed in those situations where D caused death by an act or omission which he knew had death as the probable or highly probable result .,"[17, 18]",0
In this way the chapters in this part present a number of perspectives which essentially complement and amplify the discussion in the previous part .,"[8, 9]",1
"Montenegro 's young and go-ahead leadership , which came to power this year amid furious popular dissatisfaction with the ‘ old men in grey suits ’ , sponsored the gathering of Nicholas 's surviving relatives — the first ‘ royal reunion ’ organised by a Communist government .","[33, 34]",0
This clause has never yet been activated .,"[6, 7]",1
"One of the most successful Hollywood TV producers , David Jacobs , the creator of Dallas , believes the western also fell victim to late 1960s iconoclasm .","[21, 22]",1
"But as they do , it 's gon na hit her cos it 's not year that it does n't help , see if she 's in a third year class , she was always as she is now , in the top of that , but even","[9, 10]",1
"Task analysis can be very expensive in skilled manpower , but in looking at cost/value it is important to include in value the increase in mutual understanding which occurs when a multi-disciplinary team conducts the analysis .","[19, 20]",1
"Yes but then you see , in the in the old days Gordon , I mean , you you were very fortunate if you got three meals a day and and whatever you got you were glad of and used to eat it all .","[41, 42]",0
I persevered .,"[1, 2]",0
Manchester Dispatch : I hope you will continue this form of enterprise .,"[7, 8]",0
A new canvass system was introduced in 1911 so that all county constituencies would operate the same system and so that duplicate records could be kept at area level .,"[21, 22]",0
The arrested water shone and danced .,"[1, 2]",1
"‘ But you wo n't , ’ he assured her .","[8, 9]",0
"Can you do that , do you know how to do that ?","[7, 8]",0
And that makes her feel what ?,"[2, 3]",1
"Thus , as with biological theories , crime is seen as pathological ( a disease ) , as something to be looked at from the medical point of view .","[9, 10]",1
"The party officers and Whips were solidly behind Chamberlain , but Law drew off some of his support among tariff reformers and , urged on by Edward Goulding and Max Aitken , he refused to withdraw unless his continued candidature would allow Long to win .","[12, 13]",1
"His scepticism goes to the extent of even denying the existence of ‘ society ’ or ‘ the nation ’ as such ( II , 24 , 61 ) — the very totalities which his own general argument for totalization requires .","[2, 3]",1
"There was a field of poppies and corn which reminded him only of small and large , faded and ghostly versions of Van Gogh 's "" Harvest "" which he had seen repeated in endless hospital corridors , waiting rooms , school offices .","[9, 10]",1
If you do n't know what the system is required to do ; you do n't know anything .,"[16, 17]",0
Oh that 's get his permission for nothing !,"[3, 4]",1
They seem to think that you can ask a businessman what his requirements are and get an answer that amounts to a draft system specification .,"[19, 20]",1
"He had virtually no bite , as he had once overheard Adam say to Bridget , and heard it with helpless chagrin .","[10, 11]",0
Support refers to anything which is said or done to help the offender solve or mitigate their personal or social problems : surveillance to anything which is said or done to induce the offender to conform to socially acceptable standards of behaviour .,"[13, 14]",0
I 've no no wish to learn it thank you .,"[6, 7]",0
I do n't see how they 're going to do it .,"[7, 8]",0
"I agree , it 's clearly a warning to pay , but I swear I know nothing about it .","[13, 14]",0
