text,span1,label
been reduced .,"[1, 2]",1
"Probably a case-study approach involving the application of science , and the interaction with other disciplines , would be needed .","[4, 5]",0
"they re , revamped it or whatever .","[3, 4]",0
"The point is that the traditional concepts of intention and recklessness do not , of themselves , appear to be sufficiently well focused to mark out those killings which are the most heinous .","[24, 25]",1
"thing is that you know we were at we , actually we got lost and were asking directions .","[16, 17]",0
Yeah I know .,"[2, 3]",0
"‘ The plant should be relocated because it 's in the wrong place , ’ Llew Smith , the local Euro-MP , told me .","[5, 6]",0
"There are great difficulties in assessing health effects , however , since exposure varies greatly from house to house within small neighbourhoods .","[5, 6]",0
‘ I do seem to recall something about you offering to help me with the party preparations .,"[5, 6]",1
Labour 's Quality Commission would replace the Audit Commission .,"[5, 6]",1
"And leave them , leave with them","[1, 2]",0
Saying that you now ahm replace the bones of crippled fingers,"[9, 10]",1
That wo n't last till ten I 'd rather go and rack .,"[9, 10]",0
"You 've just got to give , you know , we 've put by and we said .","[16, 17]",0
Those two add ?,"[2, 3]",1
Looking at those lists provides interesting reading and bears out the used-car trade 's view that having a lead-only car could prove to be a liability .,"[21, 22]",0
"She did not want to lose Paula , who was one of her best models , but already she was enjoying the reflected glory that came from having personally trained a house model for one of the great London couture houses .","[22, 23]",1
"Here , then , is a familiar operations research network problem : all roads have to be traversed such that the journey length/time is a minimum .","[17, 18]",0
Suddenly it grew small and poky .,"[2, 3]",0
"Some novice gardeners may not want to do much actual gardening at all , but conversely , do not want to look out every day over a scene of threadbare grass and rotting fence .","[21, 22]",0
"In this chapter some of the ways in which palaeontologists determine the way fossil animals lived are described , reanimating the dead fragments to build up a living creature .","[15, 16]",0
"Anyway , erm we went to the Polly had n't seen them in the shops anywhere and went to Caerphilly market on Saturday morning and as we were coming from it he said look there 's a shirt you want for Robert there .","[33, 34]",0
"Well , did Andy want a boy ?","[4, 5]",0
"The objections would be reduced if awareness of the risk of death was also required : in other words , if the test were the commission of a serious offence of violence plus recklessness as to death .","[4, 5]",1
"And he said er , no , he said I did n't think I had he said , but now , he said I realized that how I , was forgetting er I 'd be talking and I 'd forget sort of what I was just talking about that split second .","[16, 17]",0
The ‘ conversion ’ of the UK government has been briefly described earlier ; it is manifested in their July 1989 commitment to spend £10m. on climate change research in 1989/90 and the confident request to them from the Advisory Board for the Research Councils ( ABRC ) for an extra £11m. in 1990 and £13m. in the two succeeding years for additional environmental research .,"[59, 60]",0
‘ I have prepared the lunch . ’,"[3, 4]",0
Do you understand me ?,"[2, 3]",0
The mood of the garden will dictate its eventual style .,"[6, 7]",1
"The examples described below illustrate all these , though as yet there do not appear to be many instances of disasters in the management of which GIS has played a significant part .","[14, 15]",0
"A few Africans , clutching sticks and wearing skins , watch the plane as it turns , pauses , and then accelerates , leaving a cloud of dust .","[23, 24]",1
"The analogy is found in such ocean-going amphipods ( a kind of ‘ shrimp ’ ) as Cystosoma , which also has enormously expanded eyes , looking like headlamps , compared with its bottom-dwelling relatives ( see above ) .","[3, 4]",1
"Sharing a small spartan room with two other girls — Northerners whose accent Paula found almost incomprehensible and with whom she had nothing in common , making breakfast in the communal kitchen , queuing for the bath , adhering to a strict curfew after which time the doors were locked and bolted — none of these were restrictions Paula had the slightest intention of enduring for long .","[26, 27]",0
This question produces as varied a response as the first .,"[4, 5]",0
"In this sense the scene is clearly one of hazard problems looking for improved GIS rather than for GIS looking for good problems , as is all too often the case .","[11, 12]",0
"He could see with half an eye that the kid 's aunt was going to be one of the confident , bossy , well-connected women with whom that part of Cambridgeshire was substantially over-provided .","[2, 3]",0
It 's very badly planned you know,"[6, 7]",0
"Many American jurisdictions have three degrees of murder — first-degree murder , requiring premeditation , and second- and third-degree murder , covering lesser shades of culpability .","[12, 13]",0
"Well I shall go because if that fella 's been from , if that fella said I did n't have a job I 'll be jumping up and down like a what d' ya call it !","[3, 4]",0
"But they might have to be supplemented by mercenaries from Flanders and the Low Countries , where the rapidly expanding population forced large numbers of young men into military careers .","[21, 22]",1
They argued that existing maps and digitized files from them are unable to meet these needs at global or regional scale and only remote sensing could help in the short term : the availability of stereometric data from the French SPOT satellite has already led to proposals for automated creation of global digital elevation models with a spatial ( XY ) resolution of about 30 m ( Muller 1989 ) .,"[26, 27]",0
Erikson suggests that at different phases of life an individual faces a particular psycho-social problem which needs to be resolved before moving on to the next phase .,"[19, 20]",0
But July also passed without Debbie receiving any money .,"[3, 4]",1
Apart from the last one which he had n't got to yet and the penultimate one which seemed to apply in America more than here ( here he had joined the golf club ) he had complied with all the rest .,"[9, 10]",1
This chapter deals with the approach of the criminal law to behaviour which causes or risks causing death .,"[16, 17]",0
"She and her boyfriend have had their future planned for some time : they want to start farming in a nearby village , where they also intend to build a bungalow .","[17, 18]",0
"Bracken House , the former home of the Financial Times , became the first candidate and English Heritage then submitted some 70 recommendations to the Department of the Environment ; these included Bankside .","[19, 20]",1
"Probably the most accurate statement would be that a person intends to kill if it is his or her purpose to kill by the act or omission charged , or if he or she foresees that death is practically certain to follow from that act or omission .","[41, 42]",1
Gorgeous location overlooking a quiet bay .,"[2, 3]",1
I know why Gordon .,"[1, 2]",0
When are you gon na give up smoking and save some,"[3, 4]",0
"Yes yeah erm no there 's little point just now , go on then she 's thought of something else .","[11, 12]",1
In recent years there has been a steady accumulation of evidence that personality and allied affective factors play a crucial role in determining subject choice and student success .,"[14, 15]",0
"does n't matter I 'll , I 'll keep phoning .","[8, 9]",1
"Approved future programmes include the Upper Atmosphere Research Satellite , the NASA Scatterometer and the joint NASA/CNES Ocean Topography Experiment .","[0, 1]",0
"In contrast , other boys and most girls pondered the possible causes and ways of integrating the child into the group .","[8, 9]",0
Isobel likes scones .,"[1, 2]",0
"First he 's never seen , surprises he 's always .","[4, 5]",1
"In one of several Intifada leaflets written in Hebrew and addressed to the Israeli soldiers on duty in the occupied territories , the message was repeated : Soldier , go home .","[10, 11]",1
One such solution is Goodchild and Yang 's ( 1989 ) scheme for a hierarchical spatial data structure to handle data for the spherical earth .,"[19, 20]",0
Come on Jennifer — or are you going out with Michael ? ’,"[0, 1]",1
"His plans in ruins , he is now reduced , Micawber-like , to hoping something will turn up before his players face the All Blacks in five short weeks .","[16, 17]",1
I expect that for an ornithologist death ceases to be terrible once sight and hearing begin to go .,"[17, 18]",1
Does that mean he may lay an information and bring the matter before the magistrates without first putting the person alleged to be in default on notice of what is alleged ?,"[30, 31]",0
I have n't got any money .,"[3, 4]",0
"The biggest single difficulty in drawing attention to urban poverty is that it is not new , but simply — in some of its most worrying manifestations — getting worse .","[5, 6]",1
"Drifting between grassy polders to which farmers have to ferry their cattle in punts , or following leafy twisting lanes marked only by rusty signs proclaiming the ‘ Venise Verte ’ , you 're in an all-green , mysteriously silent world ; only the occasional fisherman , twitching his rod above the algae-smothered waters , disturbs the stillness .","[0, 1]",1
The National Union was merged with Central Office in 1911 and fusion with the Liberal Unionists followed in 1912 .,"[16, 17]",1
The small light beneath the receiver rests showed that the line was working .,"[7, 8]",1
"Well , I seem to recall a London gallery exhibiting a pile of rubbish , which was considered valid art by the proprietors and drew a large attendance .","[17, 18]",1
"Two weeks later , Clare bought the short lease of a small shop in the Pimlico Road , close to Mrs Gooden 's home .","[5, 6]",0
"So instead of waiting indefinitely for a buyer , they have decided to try selling their house by auction .","[14, 15]",0
It was not a view of things with which Frederica was entirely in sympathy : she liked naming names .,"[16, 17]",0
"Otherwise , the best place to see working trams has been the tram museum at Crich in Derbyshire or else in old British Transport Commission films and Ealing comedies .","[7, 8]",1
"There the similarity ends , since judging from his writings Bagehot was a roaring snob , whereas judging from his heckles the heckler was not .","[6, 7]",1
"They came twenty minutes early , there 's Brian up in the shower , there 's me stuffing things in the cupboard under the stairs .","[17, 18]",0
I 'm not sure that I really knew her and I 'm left wishing I 'd tried harder .,"[7, 8]",0
She had been mistaken ever to think that he would come .,"[3, 4]",0
"I do n't like , just , I could n't be like Deirdre and , put me overall on and in go in without collecting me thoughts getting myself together Deirdre never arrives till about three minutes before she gets in the door , she 's putting her overall on saying come on ladies , its time were , but she 's putting her overall and on , and they all sit there looking at her and so","[32, 33]",0
"I will lose my practice and my reputation and everything that I have and can look forward to , if not my liberty .","[2, 3]",1
For enhanced payments to child-minders caring for children with special needs .,"[1, 2]",0
Such findings give us some clues about the characteristics of boys and girls of these ages .,"[2, 3]",1
Yes but they all say that,"[4, 5]",0
"When , when I went to get my tickets she said","[6, 7]",0
"We may want to count numbers living within plumes , circles of fixed radius , buffer zones and so on .","[4, 5]",0
"alright , yeah I am I mean I 'm not alright , I feel very dizzy , like I say I feel I feel a bit kind of heady you know but I will go and have a check up .","[13, 14]",1
"Metaphor lay coiled in the name sunflower , which not only turned towards but resembled the sun , the source of light .","[11, 12]",0
"This species has a finely toothed margin ; a large , wide leaf born on a long stem .","[13, 14]",0
Double glazing ! !,"[1, 2]",0
Now if he does n't get the economy right he 's gon na end up with egg on his face and,"[11, 12]",0
‘ Do n't worry .,"[3, 4]",1
"They reached the main deck , dropping down","[1, 2]",1
You look so beautiful .,"[1, 2]",0
"But yeah , he told them !","[4, 5]",0
"He remembered a straight mass of red-gold hair , in cold King 's Chapel , more golden than foxy Frederica 's , slowly settling onto a collar as the pins released their grip .","[23, 24]",1
"Since we have so many variables , and since in each physical configuration only some of them appear , we will record ( just for this chapter ) the non-zero variables in each section heading .","[17, 18]",1
The East Kielder Burn divides here into Scaup Burn and White Kielder Burn .,"[4, 5]",0
But once the Jaguar had moved away she turned to Theresa and said in a voice of surprising gentleness : ‘ Does your father know that you 're out alone ? ’,"[5, 6]",0
"In 1986 , according to Friends of the Earth , a survey of the homes clustered on the surrounding hills found that three-quarters of 800 residents were opposed to the Rechem plant .","[3, 4]",0
"She boasted a harpoon walkway , a flybridge , and , above the highest wheel-platform , an aluminium canopy which held a radar aerial .","[20, 21]",1
"IN THE crusade to make everyone guilty about everything , there is a new technique : tetranalysis , the study of colour , sound , motion and form in movies .","[4, 5]",1
"Well we used to put , I mean , I put twelve , thirteen hundred in the Sugar House .","[4, 5]",1
"The aim of this article is to challenge the assertion contained in the White Paper Crime , Justice and Protecting the Public ( Home Office , 1990a ) that probation practice can be conceived of as a form of punishment in the community .","[10, 11]",1
"Women marry and change their names , he thought , there was no point in pursuing that one .","[15, 16]",1
"Oh well I bet , I think perhaps it is really .","[3, 4]",1
Forster scanned the corridor once more .,"[1, 2]",0
You turn right and you go down it and you 'll see a sign for Lower Thornton .,"[11, 12]",0
"But the job of lifting the standards of people employed , giving them proper training , and paying a wage which breaks dependence on overtime and lifts morale : this together must far exceed the costs of the technology , and it is n't by any means clear what the bill will be or where the money will come from .","[46, 47]",1
"Those guys put people into space , put our people on the moon .","[7, 8]",1
"Scott 's first venture into this unlikely field of design was at Battersea where , in 1930 , he was wheeled in as a famous knighted architect by the London Power Company to try to make acceptable the coal-fired monster power station to which the residents of Chelsea and Westminster were taking strong exception .","[25, 26]",0
"For therapeutic and professional staff to reflect the cultural backgrounds of the children , and that for all children , including those with special needs , their day-care environment and activities to express a consciousness of the multicultural society in Islington .","[20, 21]",0
McLeish considered .,"[1, 2]",0
"Modern audiences no longer accept plastic bushes , and the southern Californian suburban sprawl means the production companies have to take their horses and cows to locations far away in Arizona or Montana .","[14, 15]",0
‘ Together with some other clients we took the owner to court but he escaped to Spain . ’,"[7, 8]",1
Get your blood going .,"[3, 4]",1
"Yeah , we got five minutes .","[3, 4]",1
A leading example of this is the European Science Foundation which has sponsored research programmes in both the physical and social science aspects of environmental change ( ESF 1990 ) .,"[1, 2]",0
"Westerns , by their nature , demand more time on location .","[6, 7]",1
When Austen sat down Chaplin suggested that he had better put the question at once and on getting an affirmative shout did so .,"[17, 18]",1
Tell .,"[0, 1]",0
"Another recent auction in Leeds saw a run-down stone farmhouse without water or other amenities finally fall under the hammer for £330,500 .","[16, 17]",1
"We are most interested in the idea of networking , sharing skills such as translation and using them for distance learning . ’","[10, 11]",1
Well my brother 's covered practically all week and Brian 's doing tomorrow .,"[4, 5]",1
I told you to leave it and I 'll do it !,"[4, 5]",0
"‘ Thank you , ’ Paula said faintly .","[1, 2]",0
"But we must have a common code and we must have licensing , ’ he said .","[15, 16]",0
"I found it hard to picture what kind of landscape those statistics might have shaped , until I opened the Ordnance Survey map to find half of it coloured green with a great blue stain in the centre .","[18, 19]",0
"It was only when using a ‘ test ’ version of the system ( available just before the planned implementation date ) that difficulties would come to light , and a host of change requests be issued .","[18, 19]",1
All our efforts to restore unity among Christians will be in vain if they are not carried out in total fidelity to the faith in Christ … handed on by the Apostles . ’,"[27, 28]",1
On the other hand you have a whole generation of TV watchers that does n't really know the rules .,"[16, 17]",0
"The ‘ enhanced Programme resulted from the 1978 Inner Urban Areas Act , based on a White Paper , published the previous year , on Policy for the Inner Cities ( DoE , 1977 ) , the first comprehensive policy statement on the subject to acknowledge it as a definable and cohesive problem .","[19, 20]",0
It plays a key role in keeping city streets on the move and is even the object of the best modern designers ' desire .,"[6, 7]",1
It is a curiously paradoxical foundation uponupon which to build a theory of autonomy .,"[9, 10]",1
And I 've got ta get erm,"[5, 6]",0
"Drifting between grassy polders to which farmers have to ferry their cattle in punts , or following leafy twisting lanes marked only by rusty signs proclaiming the ‘ Venise Verte ’ , you 're in an all-green , mysteriously silent world ; only the occasional fisherman , twitching his rod above the algae-smothered waters , disturbs the stillness .","[18, 19]",1
"I know that , but will you make it stick .","[7, 8]",1
Digital data occupy a central position in this applications field and a number of examples are given to illustrate the extent to which their development has been hampered or facilitated in various countries by the policies of the organizations with responsibility for digital data provision .,"[16, 17]",0
Holt does not want children to be obliged to take on any of these responsibilities and he manages to make his point by concentrating solely on the rights so that he can remark :,"[23, 24]",1
"The UOC found that "" it is patent that some feeling exists among the Unionist Press that , while in the past they have done much for the Party , the Party has not assisted in their work .","[34, 35]",1
At the start of the session the tutor 's notes make clear that directing extends beyond enforcing the conditions of attendance :,"[14, 15]",1
Nevertheless a few qualitative conclusions may be drawn without doing any further mathematics .,"[7, 8]",1
"MON 9 OCT Steve Marriott & Mickey Hutton In among those on their way up , and those who will never go anywhere , the pub rock circuit plays host to those who were once really something .","[28, 29]",0
"Political , economic and social issues which arise in conducting Task Analyses are discussed in the context of Job Analysis ( p. 148 ) .","[7, 8]",1
"Anyway , so erm he said , but you know he was saying to them that er , it 's not just at the bottom end , he said , in our village in Wales we 've got the Sun have now positioned two reporters who have lived in the village the these they sit in a car outside his house day and night","[37, 38]",1
"Plus a backdrop of houses covering the valley walls on either side , a reminder that wherever industrialised societies decide to deal with their most intractable problems , they are unlikely to find a place to do so which is not in somebody 's back yard .","[32, 33]",1
They do n't give a fuck,"[3, 4]",1
"It 's alright , I 'll see it later on , it 's on again","[6, 7]",0
"The plaque was unadorned , the letters deeply carved in an elegant script reminiscent of Eric Gill , and Dalgliesh remembered his aunt telling him that it had been placed there by previous owners in the late twenties , when the cottage was originally extended .","[23, 24]",0
"Section 22 of the 1979 Estate Agents Act dealing with bonding , licensing and standards of competency has not been brought in .","[20, 21]",1
"He was in agreement with my suggestion that the property be sold and before he returned to college in the autumn of 1976 , he took my advice and placed house and lands in the hands of an estate agent .","[25, 26]",1
This furthered his long-term ambition to rule a large ‘ south Slav ’ kingdom when the Ottoman Empire finally collapsed .,"[6, 7]",1
You might have given her another stroke . ’,"[3, 4]",1
shut up,"[0, 1]",0
He was asked to wait and then shown into a room where a detective sergeant prepared to take a statement from him .,"[15, 16]",1
Its villages look too good to be true .,"[2, 3]",0
"Charlotte please , can you walk nicely ?","[1, 2]",0
"I wished that Ellen and Rickie would go to their beds , for the soft mutter of their voices was an intrusion on the dark and star-studded infinity through which I steered Wavebreaker .","[26, 27]",1
One might ask whether motorists are ever justified in knowingly taking risks with other people 's lives .,"[7, 8]",0
"‘ It ai n't bad being aboard , ’ he said , and held out his hand and , not before time , we shook .","[13, 14]",0
"But if the valuer is negligent and you buy the property relying on his report , you may still be able to sue him for damages .","[8, 9]",0
I was surprised that he so eagerly sought to confront me .,"[7, 8]",0
"He watched his aunt and Miss Williams wordlessly consult each other , but knew his aunt would do as she was told ; successful solicitor though she was , she was ten years younger than Miss Williams and , as she complained , totally intimidated by her as she had not been by anyone since her late headmistress .","[13, 14]",0
"In the end , it was not in Outremer but in the newly conquered Byzantine empire that the Flemish crusading achievement was crowned with the elevation of Count Baldwin IX to the imperial throne in 1204 .","[22, 23]",1
The 10 p.c. gain since election day is looking increasingly sustainable .,"[8, 9]",1
I do n't know .,"[3, 4]",0
Parliament should give fresh thought to enacting a provision placing an obligation upon a council tenant to give notice to the council before being permitted to commence proceedings .,"[2, 3]",1
Sixty three divided by nine is six !,"[2, 3]",1
"hang about , you see what it says here oh you do n't play that one , just the something for you to write underneath , I thought it was complicated","[13, 14]",0
"Nor was it clear that Balfour 's departure was universally desired : at the National Union Conference a few days later , Leo Maxse was booed off the platform , and constituency parties everywhere passed resolutions regretting Balfour 's decision .","[36, 37]",1
"In three other areas , as much political as organizational , advances were made towards the management of the press , the coordination of the heterogeneous collection that made up the party , and the fostering of modern attitudes in the local parties .","[13, 14]",1
"E VEN at this late hour , psephology , demographics and luck suggest that the Tories could still emerge as the biggest single party in a hung Parliament .","[12, 13]",1
I said try and start thinking about getting in there because,"[4, 5]",0
"Where such arguments did not fit in with the overarching themes of race , violence and disorder , and social deprivation they were either sidelined or pushed into the sub-clauses of official reports .","[26, 27]",1
"Buddy invites us to regard Holly in the same light , mocking ( in a horribly nudging re-creation ) Lubbock old-timers like The Hayriders , who sing : ‘ When the sun goes down on Blue Ridge Mountain It 's the time to whistle in your ear . ’","[4, 5]",1
‘ I can not honestly see that a system which would require us to compromise the morning after the election is really so morally inferior to a system which has already obliged us to compromise our policies two years before polling day . ’,"[31, 32]",1
"After they reached two thousand feet , the instructor showed her how to fly level ; he then encouraged her to experiment with the stick , manoeuvring the plane m every direction .","[18, 19]",0
"We found there that by choosing a scalar function in the form formula we could automatically satisfy the other equation for the electric field strength , formula .","[5, 6]",0
"They looked as if they had been dressed in a hurry and not very suitably for a long walk on the headland , even in a warm autumn .","[7, 8]",0
Yeah well she 's sort of with the third year and will admit she 's so fed up !,"[12, 13]",1
Got ta get moving .,"[3, 4]",1
What time of day do you think you call this !,"[8, 9]",1
What Andrew Motion presents us with here is a static and humourless mood-piece filled with over-elaborate imagery .,"[3, 4]",1
Her sole purpose in being there was to meet him and she was content that he should know it .,"[17, 18]",0
